Address,Price,Property Type,Bedrooms,Bathrooms,Size
"Grove Park Road, London, SE9","£350,000",Flat,2.0,1.0,Ask agent
"Capitol Way, London","£350,000",Flat,2.0,1.0,Ask agent
"Brunswick Park Road, London","£350,000",Flat,1.0,1.0,574 sq ft
"Basingdon Way, Denmark Hill, London, SE5","£350,000",Flat,3.0,1.0,815 sq ft
"Southerngate Way, New Cross, SE14","£350,000",Apartment,2.0,1.0,Ask agent
"Kingston Road, Wimbledon Chase, London, SW20 8LX","£350,000",Flat,1.0,1.0,Ask agent
"Findon Road, London, W12","£350,000",Apartment,1.0,1.0,362 sq ft
"Brixton Hill, London, SW2","£350,000",Apartment,1.0,1.0,462 sq ft
"Craven Park, London, NW10","£350,000",Apartment,2.0,1.0,499 sq ft
"Greenwich High Road, Greenwich, SE10","£350,000",Apartment,2.0,1.0,Ask agent
"Elmslie Point, Bow, London, E3","£350,000",Flat,2.0,1.0,655 sq ft
"37 Bollo Bridge Road, Acton London W3 8AT","£350,000",Flat,1.0,,Ask agent
"Pomeroy Street, Peckham, London, SE14","£350,000",Flat,1.0,1.0,555 sq ft
"Harrow Road, London, W10","£350,000",Apartment,2.0,1.0,981 sq ft
"Kyverdale Road, Stoke Newington","£350,000",Flat,1.0,1.0,Ask agent
"Love Lane, London, SE18","£350,000",Flat,2.0,1.0,Ask agent
"Brownhill Road, Catford","£350,000",Flat,2.0,1.0,Ask agent
"Blythe Road, London","£350,000",Flat,1.0,1.0,Ask agent
"Brookmill Road, London, SE8","£350,000",Apartment,1.0,,Ask agent
"Russell Court, Bloomsbury, WC1H","£350,000",Studio,,1.0,266 sq ft
"Stanley Road, Enfield","£350,000",Maisonette,2.0,1.0,Ask agent
"Danbrook Road, London, SW16","£350,000",Apartment,1.0,1.0,478 sq ft
"Richmond Road, Cranmer Court Richmond Road, KT2","£350,000",Apartment,2.0,1.0,570 sq ft
"Kingfisher Heights, E16, Docklands, London, E16","£350,000",Flat,1.0,1.0,497 sq ft
"High Road, London","£350,000",Maisonette,3.0,2.0,Ask agent
"Garratt Terrace, London, SW17","£350,000",Apartment,1.0,1.0,553 sq ft
"George Row, Bermondsey, London, SE16","£350,000",Flat,1.0,1.0,522 sq ft
"Magdalene Gardens, Whetstone, London","£350,000",Flat,2.0,2.0,829 sq ft
"Scrutton Close, London, SW12","£350,000",Apartment,2.0,1.0,687 sq ft
"High Road, Leytonstone, E11","£350,000",Flat,2.0,1.0,420 sq ft
"Elektron Tower, 
12 Blackwall Way, E14","£350,000",Flat,1.0,1.0,484 sq ft
"Chamberlain Court, Upton Gardens, 16 Shipbuilding Way, London, E13","£350,000",Apartment,1.0,1.0,Ask agent
"Wedmore Gardens, Archway, N19","£350,000",Apartment,1.0,1.0,Ask agent
"Albion Way, London","£350,000",Apartment,2.0,1.0,Ask agent
"Beaconsfield Road, London, E16","£350,000",Maisonette,3.0,1.0,764 sq ft
"Sandrock Road, London, SE13","£350,000",Maisonette,2.0,1.0,Ask agent
"The Vale, London","£350,000",Flat,2.0,2.0,Ask agent
"15 Medawar Drive, Mill Hill, NW7","£355,000",Ground Flat,1.0,1.0,Ask agent
"Pegler Square, London, SE3","£355,000",Flat,1.0,1.0,Ask agent
"Henley Drive, 
Bermondsey, SE1","£355,000",Flat,1.0,1.0,388 sq ft
"Helene House, Vandome Close, London, E16","£355,000",Flat,2.0,1.0,Ask agent
"Crystal Palace Park Road, Crystal Palace, London, SE26","£355,000",Flat,1.0,1.0,584 sq ft
"Munster Road, Munster Village, London, SW6","£355,000",Flat,1.0,1.0,491 sq ft
"Bell Green, London","£355,000",Apartment,2.0,1.0,Ask agent
"Avenue Road
London
N14 4DG","£355,000",Apartment,1.0,1.0,541 sq ft
"Hulford Apartments, Woolwich Road, London, SE7","£355,000",Apartment,1.0,1.0,Ask agent
"Vermont Close, Enfield, Middlesex, EN2","£355,000",Apartment,2.0,1.0,Ask agent
"Mortlake High Street, Mortlake, London","£355,000",Flat,1.0,1.0,Ask agent
"Leyland Court, Sumner Road, Peckham, London, SE15","£355,000",Flat,1.0,1.0,670 sq ft
"76 Woodlands Avenue, London, N3","£355,000",Flat,1.0,1.0,Ask agent
"Mahindra Way, London","£355,000",Flat,1.0,1.0,689 sq ft
"Lismore Boulevard, Colindale","£355,000",Flat,1.0,1.0,537 sq ft
"Wilmot Street, Bethnal Green, London, E2","£355,000",Flat,1.0,1.0,375 sq ft
"Peterborough Road, London, SW6","£355,000",Apartment,1.0,1.0,398 sq ft
"Rose Bates Drive, Kingsbury, London, NW9","£355,000",Apartment,2.0,2.0,Ask agent
"St Helen's Road, Norbury, London, SW16","£355,000",Flat,1.0,1.0,635 sq ft
"Hazlewood Crescent, London","£355,000",Flat,1.0,1.0,Ask agent
"Colina Road, Haringey","£355,000",Maisonette,1.0,1.0,582 sq ft
"Selsdon Road, Wanstead","£355,000",Apartment,2.0,1.0,724 sq ft
NW9,"£355,000",Maisonette,2.0,1.0,Ask agent
"Marcon Place, Hackney, London, E8","£355,000",Flat,1.0,1.0,528 sq ft
"134 Rowan House, New Avenue, Southgate","£355,000",Apartment,1.0,1.0,541 sq ft
"Rose Bates Drive, Kingsbury, London, NW9","£355,000",Apartment,2.0,2.0,Ask agent
"Hurley House, 70 Broom Road, Teddington TW11","£355,000",Flat,1.0,,493 sq ft
"Grove Lane, London","£355,000",Apartment,1.0,1.0,Ask agent
"Blackwell Close, Winchmore Hill, N21 - Priced to Sell","£355,000",Apartment,2.0,1.0,807 sq ft
"Chapter Road, London, NW2","£355,000",Apartment,1.0,1.0,Ask agent
"Bell Green, LONDON","£355,000",Flat,2.0,1.0,Ask agent
"Crofton Way, Enfield, EN2","£355,000",Flat,2.0,1.0,Ask agent
"Shearwater Drive, London, NW9","£354,995",Flat,1.0,,Ask agent
"Moorhen Drive, London, NW9","£354,995",Apartment,1.0,,Ask agent
"Cleveland Park Avenue, London","£354,995",Apartment,2.0,1.0,Ask agent
"Langhorn Drive, Twickenham","£354,950",Flat,2.0,1.0,Ask agent
"Greenview Drive, Raynes Park","£360,000",Flat,1.0,1.0,495 sq ft
"Grove Vale, East Dulwich","£360,000",Flat,1.0,,Ask agent
"Granary Mansions, Thamesmead, London, SE28","£360,000",Flat,2.0,2.0,808 sq ft
"Chaseville Park Road, N21","£360,000",Flat,2.0,1.0,Ask agent
"Grove Vale, East Dulwich","£360,000",Flat,1.0,,Ask agent
"Great West Road, Brentford","£360,000",Flat,1.0,2.0,Ask agent
"Hitcham Road, London","£360,000",Ground Flat,2.0,1.0,Ask agent
"Hermon Hill, Wanstead, E11 2AR","£360,000",Apartment,1.0,1.0,570 sq ft
"Villiers Road, Willesden, London, NW2","£360,000",Apartment,2.0,1.0,616 sq ft
"Nest Way, Starling Court, SE2","£360,000",Apartment,2.0,2.0,850 sq ft
"Westfields Avenue, Barnes","£360,000",Flat,1.0,1.0,Ask agent
"Baltic Apartments, Royal Docks E16","£360,000",Flat,1.0,1.0,Ask agent
"Bowen Drive, Charlton, SE7","£360,000",Apartment,1.0,1.0,Ask agent
"Napier House, Bromyard Avenue, Acton, London W3 7FF","£360,000",Apartment,1.0,1.0,496 sq ft
"Trinity Street, Borough, London, SE1","£360,000",Flat,1.0,1.0,377 sq ft
"Campbell Gordon Way, London, NW2","£360,000",Ground Flat,2.0,1.0,Ask agent
"Westfields Avenue, London, SW13","£360,000",Apartment,1.0,1.0,474-475 sq ft
"Worsopp Drive, Clapham, London, SW4","£360,000",Flat,2.0,1.0,701 sq ft
"Roe Lane, Kingsbury, London, NW9","£360,000",Ground Flat,2.0,1.0,56 sq ft
"253 Horn Lane, London, W3","£360,000",Apartment,1.0,1.0,Ask agent
"Courtfield Gardens, Earls Court","£360,000",Apartment,,1.0,Ask agent
"River Court, Wanstead","£360,000",Apartment,2.0,1.0,Ask agent
"Streatham Hill, Streatham Hill, London, SW2","£360,000",Flat,2.0,1.0,680 sq ft
"Cotton Avenue, Acton, London, W3","£360,000",Flat,2.0,1.0,597 sq ft
"Clifden Road, Twickenham, Middlesex, TW1","£360,000",Flat,2.0,1.0,Ask agent
"Rookery Court, Ruckholt Road London E10","£360,000",Apartment,1.0,1.0,Ask agent
"Long Lane, Borough, London, SE1","£360,000",Studio,,1.0,340 sq ft
"Corker Walk, Islington, N7","£360,000",Flat,2.0,1.0,527 sq ft
"All Saints Road, Acton, London, W3","£360,000",Flat,1.0,1.0,595 sq ft
"Welham Road, Southgate","£360,000",Flat,1.0,1.0,Ask agent
"Guthrum Court, Royal Albert Wharf, 1 Cavendish Square, London, E16","£360,000",Apartment,1.0,1.0,544 sq ft
"Crofton Way, Enfield, EN2","£360,000",Flat,2.0,1.0,Ask agent
"1  Appleford Road, London, W10 5EF","£360,000",Flat,2.0,1.0,Ask agent
"Royal Drive, London","£360,000",Apartment,2.0,2.0,Ask agent
"Bournbrook Road, London, SE3","£360,000",Terraced,2.0,1.0,Ask agent
"Babington Road, Streatham","£360,000",Flat,2.0,1.0,Ask agent
"Leamington Park, Acton","£360,000",Flat,1.0,1.0,Ask agent
"Rosenau Road, Battersea, London, SW11","£360,000",Flat,2.0,1.0,Ask agent
"Appleford Road, London, W10","£360,000",Apartment,2.0,1.0,759 sq ft
"Juxon Street, London, SE11","£360,000",Flat,1.0,1.0,Ask agent
"St. Marks Road, Enfield","£360,000",Maisonette,2.0,1.0,Ask agent
"Clifden Road, Twickenham, TW1","£360,000",Flat,2.0,1.0,877 sq ft
"Tavistock Crescent, Portobello, London, W11","£360,000",Flat,1.0,1.0,488 sq ft
"Cheesemans Terrace, London, W14","£360,000",Flat,1.0,1.0,493 sq ft
"Bartholomew House, North Kensington, W10","£360,000",Apartment,1.0,1.0,495 sq ft
"Wharfside Point South, E14, Canary Wharf, London, E14","£360,000",Flat,1.0,1.0,448 sq ft
"High Street, Brentford","£360,000",Apartment,2.0,1.0,Ask agent
"Streatham High Road, Streatham","£360,000",Flat,1.0,1.0,Ask agent
"Melrose Avenue, Wood Green","£360,000",Apartment,2.0,1.0,Ask agent
"Beaconsfield Road, Mottingham, SE9","£360,000",End of Terrace,2.0,1.0,Ask agent
"Primrose Place, Isleworth","£359,950",Flat,2.0,2.0,Ask agent
"Hotspur Street, London, SE11","£360,000",Apartment,1.0,1.0,Ask agent
"Oakman House, Southfields, SW19","£360,000",Apartment,2.0,1.0,Ask agent
"Cannon Hill Lane, Raynes Park","£360,000",Flat,1.0,1.0,Ask agent
"Scorpio Court, 14 Zodiac Close, Edgware, Middlesex, HA8","£360,000",Apartment,2.0,1.0,Ask agent
"Highgate Hill, N19 5NA","£360,000",Studio,,1.0,387 sq ft
"Brentmead Place, London, NW11","£360,000",,,,"3,413 sq ft"
"Perry Hill, Catford","£360,000",Flat,2.0,1.0,Ask agent
"Lismore Boulevard, Colindale Gardens, Colindale, NW9","£360,000",Apartment,1.0,1.0,576 sq ft
"Westcombe Park Road, London","£360,000",Apartment,2.0,1.0,Ask agent
"King Street Mews, East Finchley, London, N2","£360,000",Apartment,1.0,1.0,Ask agent
"Villiers Road, Willesden, London, NW2","£360,000",Apartment,2.0,1.0,616 sq ft
"Dorset Mews, Finchley Central N3","£360,000",Maisonette,1.0,1.0,409 sq ft
"Stubbs Drive, London, SE16","£360,000",Apartment,2.0,1.0,Ask agent
"Colmer Road, Streatham","£360,000",Apartment,1.0,1.0,Ask agent
"Clitterhouse Road, Cricklewood, London, NW2","£360,000",Flat,2.0,1.0,601 sq ft
"Galba Court, Augustus Close, London TW8","£360,000",Flat,1.0,1.0,525 sq ft
"Hawarden Hill, Dollis Hill","£360,000",Flat,2.0,1.0,Ask agent
"Cambridge Road, West Wimbledon, SW20","£360,000",Apartment,1.0,1.0,Ask agent
"Stanley Road, Teddington","£360,000",Flat,1.0,1.0,Ask agent
"Courtfield Gardens, Earls Court","£360,000",Flat,,1.0,Ask agent
"Park Place, London N3","£360,000",Apartment,1.0,1.0,411 sq ft
"Tildesley Road, London, SW15","£360,000",Flat,4.0,1.0,Ask agent
"108 Great Dover Street, London, SE1 4EE","£360,000",Apartment,2.0,1.0,775 sq ft
"New Cross Road, London","£360,000",Apartment,1.0,1.0,612 sq ft
"Evelyn Walk, London, N1","£360,000",Apartment,2.0,1.0,657 sq ft
"Valley Grove, Charlton, London, SE7","£360,000",Flat,3.0,1.0,708 sq ft
"Tildesley Road, London, SW15","£360,000",Flat,4.0,1.0,Ask agent
"Adenmore Road, Catford","£360,000",Flat,1.0,1.0,Ask agent
"Sherman House, Aberfeldy Street, Poplar, E14 0NQ","£360,000",Flat,2.0,2.0,Ask agent
"Malden Place, Kentish Town","£360,000",Flat,1.0,1.0,Ask agent
"Oakland Quay, Canary Wharf, London, E14","£360,000",Flat,,1.0,345 sq ft
"Wandsworth Road, London","£360,000",House,1.0,1.0,Ask agent
"Leigham Court Road, London, SW16","£360,000",Apartment,2.0,1.0,Ask agent
"Oakleigh Avenue, Whetstone","£360,000",Flat,1.0,1.0,Ask agent
"Westgate House, Ealing, London, W5","£360,000",Flat,1.0,1.0,358 sq ft
"Ship Yard, Canary Wharf, London, E14","£360,000",Flat,1.0,1.0,492 sq ft
"Craybury End, Eltham, SE9","£360,000",Terraced,2.0,1.0,Ask agent
"Titley Close, Chingford, E4 8PL","£360,000",Flat,2.0,2.0,Ask agent
"Bathurst House, White City Estate, London, W12","£360,000",Apartment,2.0,1.0,Ask agent
"Stockwell Green, London, SW9","£360,000",Flat,1.0,1.0,Ask agent
"Point West, Cromwell Road, London SW7","£360,000",Studio,,1.0,376 sq ft
"Devonshire Road, Forest Hill, London, SE23","£360,000",Flat,1.0,1.0,Ask agent
"Manchester Road, London","£360,000",Apartment,1.0,1.0,Ask agent
"Selwyn Road, Plaistow, London, E13","£360,000",Flat,2.0,1.0,756 sq ft
"Taylor House, E14, Westferry, London, E14","£360,000",Flat,1.0,1.0,439 sq ft
"Robert Lowe Close, London","£360,000",Apartment,3.0,1.0,640 sq ft
"Finchley Lane, Hendon, London, NW4","£360,000",Flat,2.0,1.0,699 sq ft
"Goulden House, Bullen Street, Battersea, London, SW11","£360,000",Flat,1.0,1.0,470 sq ft
"Cannon Road, London","£360,000",Flat,2.0,1.0,Ask agent
"Swanton Gardens, Southfields, London, SW19","£360,000",Maisonette,3.0,1.0,747 sq ft
"Stepney Way, London, E1 3","£360,000",Maisonette,2.0,1.0,705 sq ft
"Pynham Close, Abbey Wood, London, SE2","£360,000",Terraced,2.0,1.0,Ask agent
"High Street, London","£360,000",Apartment,2.0,,664 sq ft
"South Grove,
Waltham Forest,
E17","£360,000",Flat,1.0,,Ask developer
"Hornsey Road, Islington, London, N7","£360,000",Flat,2.0,2.0,795 sq ft
"Yelverton Road, London, SW11","£360,000",Flat,2.0,1.0,Ask agent
"Clapham Road, Clapham","£360,000",Studio,,1.0,Ask agent
"Princess Park Manor, London, N11","£360,000",Flat,2.0,2.0,755 sq ft
"Barton Court, Barons Court Road, W14","£360,000",Studio,,1.0,Ask agent
"Charrington Tower, New Providence Wharf, London, E14","£360,000",Apartment,,1.0,Ask agent
"43 Hermon Hill, Wanstead, E11","£360,000",Apartment,1.0,1.0,571 sq ft
"23 Hereford Road, London, W3","£360,000",Flat,1.0,1.0,453 sq ft
"Bledlow Close, Thamesmead, London, SE28","£360,000",Terraced,3.0,1.0,Ask agent
"Pankhurst Avenue, LONDON, London, E16","£360,000",Flat,2.0,1.0,603 sq ft
"Millharbour, Canary Wharf, London, E14","£360,000",Flat,1.0,1.0,551 sq ft
"Rose Bates Drive, London, NW9","£360,000",Apartment,2.0,1.0,Ask agent
"Foster Road, London, W4","£360,000",Apartment,1.0,1.0,Ask agent
"West Barnes Lane, West Wimbledon","£360,000",Flat,1.0,1.0,Ask agent
"Hawarden Hill, London, NW2","£360,000",Flat,2.0,1.0,Ask agent
"St. Benedicts Close, London, SW17","£360,000",Apartment,2.0,1.0,Ask agent
"The Lighterman, 1 Pilot Walk, Lower Riverside, Greenwich Peninsula, SE10","£360,000",Studio,,1.0,423 sq ft
"Rye Mansions, Stratford, E20","£360,000",Flat,1.0,1.0,594 sq ft
"Aldrington Road, Streatham, SW16","£360,000",Flat,3.0,1.0,Ask agent
"Stoneleigh Road, London","£360,000",Flat,3.0,1.0,Ask agent
"Barrow Road, London, SW16","£360,000",Apartment,2.0,1.0,Ask agent
"Chiswick High Road,, Chiswick, London, W4","£360,000",Studio,,1.0,412 sq ft
"Rayne Court, Snaresbrook","£360,000",Apartment,1.0,1.0,558 sq ft
"St. Johns Road, Isleworth","£360,000",Apartment,1.0,1.0,543 sq ft
"Lismore Boulevard, Reverence House, NW9","£360,000",Apartment,1.0,1.0,549 sq ft
"Barnhill Road, Wembley, Middlesex, HA9","£360,000",Ground Flat,2.0,1.0,Ask agent
"Storey House, Cottage Street","£359,999",Maisonette,2.0,1.0,Ask agent
"Seacon Tower, Hutchin Street, South Quay, Westferry, Canary Wharf, London, E14 8JX","£359,995",Apartment,1.0,1.0,Ask agent
"Tabard Street, London Bridge, London","£359,995",Apartment,1.0,1.0,496 sq ft
"Buckingham Avenue, London","£359,950",Maisonette,2.0,1.0,646 sq ft
"Electra Court, Station Parade, London, NW2","£359,950",Flat,1.0,1.0,Ask agent
"Sellons Avenue, Harlesden, NW10","£359,950",Flat,2.0,1.0,425 sq ft
"Woodlands Road, Isleworth","£359,950",Flat,1.0,1.0,807 sq ft
"Ajax Court, Ajax Avenue, Colindale, London, NW9","£359,950",Maisonette,2.0,1.0,Ask agent
"Rosemont Road, Acton","£359,950",Flat,2.0,1.0,Ask agent
"Station Road, London","£359,000",Apartment,1.0,,Ask agent
"Thames Court, Hanway Road, London, W7","£359,000",Flat,3.0,2.0,Ask agent
"Century House, 102 Westminster Bridge Road, Waterloo, SE1","£358,000",Apartment,1.0,1.0,415 sq ft
"Ottley Drive, London, SE3","£358,000",Apartment,1.0,1.0,411 sq ft
"Perryfield Way, 
Hendon,
London, 
NW9 7DL","£357,500",Flat,1.0,,548 sq ft
"Elbe Street, Fulham, SW6","£357,500",Studio,,1.0,364 sq ft
"Chapter Road, Dollis Hill, NW2","£357,500",Flat,2.0,1.0,Ask agent
"Willingham Terrace, Kentish Town","£357,000",Flat,1.0,1.0,Ask agent
"Adriatic Apartments, Royal Victoria, E16","£357,000",Apartment,1.0,1.0,Ask agent
"Woodberry Grove,
North London,
N4 2UQ","£356,250",Flat,1.0,1.0,549 sq ft
"Village Road, Enfield, EN1","£365,000",Flat,2.0,1.0,589 sq ft
"Copenhagen Court, 
Yeoman Street, SE8","£365,000",Flat,,1.0,435 sq ft
"Avenue Road
London
N14 4DG","£365,000",Apartment,1.0,1.0,541 sq ft
"Crescent Grove, London, SW4","£365,000",Flat,1.0,1.0,476 sq ft
"Time House, 
71 Plough Road, SW11","£365,000",Flat,1.0,1.0,532 sq ft
"204 Hoe Street, London, E17","£365,000",Apartment,1.0,1.0,Ask agent
"Beaufort Square, Beaufort Park, NW9","£365,000",Apartment,1.0,1.0,506 sq ft
"Union Lane, Isleworth, TW7","£365,000",Flat,2.0,2.0,Ask agent
"Wilshaw Close, London, NW4","£365,000",Flat,2.0,2.0,Ask agent
"Cantley Gardens, Crystal Palace, SE19","£365,000",Apartment,3.0,1.0,Ask agent
"75 Madeley Road, Ealing, W5","£365,000",Flat,1.0,1.0,Ask agent
"Seven Sea Gardens, London, E3","£365,000",Flat,1.0,1.0,Ask agent
"Pelling Street, Canary Wharf","£365,000",Flat,2.0,1.0,Ask agent
"Millennium Place, London, E2","£365,000",Flat,1.0,1.0,Ask agent
"Wood street,
Walthamstow,
E17 3LX","£365,000",Apartment,1.0,,Ask developer
"Linton Grove, West Norwood, SE27","£365,000",Flat,1.0,1.0,505 sq ft
"Kerswell Court Rolfe Terrace, London, SE18","£365,000",Flat,1.0,1.0,Ask agent
"Pan Peninsula Square, London","£365,000",Studio,,1.0,Ask agent
"Lucas Road, London","£365,000",Flat,2.0,,624 sq ft
"Walworth Road, Kennington, London, SE1","£365,000",Studio,,1.0,376 sq ft
"College Road, Crystal Palace, SE19","£365,000",Apartment,2.0,1.0,Ask agent
"25 Congo Road, London SE18 1TF","£365,000",Terraced,2.0,,Ask agent
"Cheesemans Terrace, Barons Court, London, W14","£365,000",Flat,1.0,1.0,553 sq ft
"Carleton Road, London","£365,000",Flat,1.0,1.0,544 sq ft
"Wisteria Road, SE13 5HW","£365,000",Apartment,1.0,1.0,607 sq ft
"Whitton Road, Twickenham","£365,000",Flat,1.0,1.0,Ask agent
"West End Avenue, Leyton, London, E10","£365,000",Flat,1.0,1.0,Ask agent
"Wood Lane,
White City,
London,
W12 7RQ","£365,000",Flat,1.0,,Ask developer
"Arlington Road, Twickenham","£365,000",Flat,1.0,1.0,Ask agent
"Sylvan Road, SE19, Crystal Palace, London, SE19","£365,000",Flat,2.0,1.0,785 sq ft
"Chaplin House, Hoe Street, London, E17","£365,000",Flat,1.0,1.0,Ask agent
"Pan Peninsula Square, Canary Wharf, London, E14","£365,000",Flat,,1.0,490 sq ft
"Sales and Marketing Suite address:
Imperial Building,
No.2 Duke of Wellington Avenue,
London, Royal Arsenal Riverside
SE18 6FR","£365,000",Apartment,1.0,1.0,544 sq ft
"Vincent Gardens, London, NW2","£365,000",Maisonette,2.0,1.0,Ask agent
"Baltimore Wharf, Canary Wharf, E14 9AQ","£365,000",Studio,,1.0,Ask agent
"Hopgood Tower, LONDON","£365,000",Apartment,1.0,1.0,Ask agent
"Cronin Street, London","£365,000",Apartment,2.0,1.0,Ask agent
"Union House, 11 Bunton Street, Woolwich, London, SE18","£365,000",Apartment,2.0,2.0,663 sq ft
"Archer Road, London","£365,000",Maisonette,3.0,1.0,667 sq ft
"Ashburnham Grove, Greenwich, London, SE10","£365,000",Apartment,,1.0,456 sq ft
"Mowbray Road, London","£365,000",Apartment,1.0,1.0,Ask agent
"West Thamesmead Gateway, Plumstead, SE28","£365,000",Apartment,1.0,1.0,490 sq ft
"Tommy Flowers Mews, London, NW7","£365,000",Flat,1.0,1.0,Ask agent
"Duckett Street, Stepney, E1 4RW","£365,000",Flat,1.0,1.0,Ask agent
"Woolwich Road, Greenwich, London, SE10","£365,000",Flat,2.0,1.0,707 sq ft
"Fishers Lane, London, W4","£365,000",Flat,1.0,1.0,509 sq ft
"Sherrington Court, Canning Town E16","£365,000",Flat,1.0,1.0,587 sq ft
"Woolwich High Street, Woolwich, London, SE18","£365,000",Flat,1.0,1.0,571 sq ft
"Stanswood Gardens, Camberwell, London","£365,000",Apartment,2.0,1.0,Ask agent
"Rectory Field Crescent, LONDON","£365,000",Apartment,2.0,1.0,Ask agent
"High Road, London, N12","£365,000",Flat,1.0,1.0,Ask agent
"Highgate Hill, Archway","£365,000",Apartment,,1.0,Ask agent
"West Barnes Lane, New Malden, KT3","£365,000",Ground Flat,2.0,1.0,546 sq ft
"Eltham Road, Lee","£365,000",Maisonette,2.0,1.0,Ask agent
"Rose Bates Drive, Kingsbury, London, NW9","£365,000",Apartment,2.0,1.0,593-594 sq ft
"Millharbour, 
Millwall, E14","£365,000",Flat,1.0,1.0,485 sq ft
"Hoy Close, Colindale, LONDON, NW9","£365,000",Flat,1.0,1.0,669 sq ft
"Romford Road, Stratford, London, E15","£365,000",Flat,2.0,1.0,643 sq ft
"Grand Drive, Raynes Park, SW20","£365,000",Apartment,2.0,1.0,Ask agent
"Cordelia Street, London, E14","£365,000",Flat,1.0,1.0,505 sq ft
"Roma Corte, Emira Street, SE13","£365,000",Apartment,1.0,1.0,Ask agent
"Vellum Court, Hillyfield, Walthamstow, E17","£365,000",Flat,1.0,1.0,Ask agent
"Belvedere Road, London","£365,000",Apartment,1.0,1.0,Ask agent
"Worple Road, West Wimbledon","£365,000",Flat,1.0,1.0,Ask agent
"Windsor Road, London, W5","£365,000",Flat,1.0,1.0,388 sq ft
"Streatham High Road, Streatham, SW16","£365,000",Flat,2.0,2.0,781 sq ft
"Corson House, Tower Hamlets, London, E14","£365,000",Studio,,1.0,404 sq ft
"The Lighterman, 1 Pilot Walk, Lower Riverside, Greenwich Peninsula, SE10","£365,000",Studio,,1.0,423 sq ft
"Binnacle House, Cobblestone Square, Wapping, EW1","£365,000",Studio,,1.0,353 sq ft
"Cornwall Road, Tottenham, London, N15","£365,000",Apartment,3.0,1.0,Ask agent
"St Marks Road, Teddington, Middlesex, TW11","£365,000",Apartment,1.0,1.0,Ask agent
"Exeter Road, London","£365,000",Apartment,2.0,2.0,Ask agent
"Cornmow Drive, Dollis Hill, London, NW10","£365,000",Flat,2.0,1.0,647 sq ft
"Percy Gardens, Isleworth","£365,000",Apartment,2.0,1.0,Ask agent
"Caledonian Road,  Islington, N1","£365,000",Flat,1.0,1.0,570 sq ft
"Wilding Court, Eden Road, Walthamstow, London, E17","£365,000",Flat,1.0,1.0,471 sq ft
"Poplar High Street, Poplar, E14","£365,000",Apartment,2.0,1.0,Ask agent
"Valencia Close, Poplar, E14 0LB","£365,000",Apartment,1.0,1.0,533 sq ft
"Mowbray Road, Brondesbury, NW6","£365,000",Apartment,1.0,1.0,503 sq ft
"West Parkside, London, SE10","£365,000",Apartment,2.0,1.0,Ask agent
"Beaconsfield Road, London","£365,000",Flat,2.0,1.0,Ask agent
"Spacious 2 Bed property Robin Crescent E6 5XA £365,000","£365,000",Flat,2.0,1.0,Ask agent
"Beaufort Square, Colindale, NW9","£365,000",Apartment,1.0,1.0,Ask agent
"Ellesmere Court, Seymour Villas, London","£365,000",Flat,2.0,1.0,Ask agent
"Mile End Road, Mile End","£365,000",Flat,1.0,1.0,Ask agent
"Fairfield Road, Bow, London, E3","£365,000",Flat,1.0,1.0,485 sq ft
"York Road, Acton","£365,000",Flat,1.0,1.0,Ask agent
"Hamme Building, 25 Shackleton Way, Newham, London, E16","£365,000",Apartment,1.0,1.0,570 sq ft
"Albans Close, 14 Leigham Court Road, SW16","£365,000",Apartment,1.0,1.0,Ask agent
"Cassilis Road, London, E14","£365,000",Flat,1.0,1.0,Ask agent
"New Park Road, Brixton Hill","£365,000",Flat,2.0,1.0,Ask agent
"Bellville House, 4 John Donne Way, Greenwich, London, SE10","£365,000",Apartment,1.0,1.0,538 sq ft
"Gilmore Road, London, SE13","£365,000",Flat,2.0,1.0,Ask agent
"London Road, Isleworth","£365,000",Flat,2.0,1.0,Ask agent
"Starling Court, Southmere, 1 Nest Way, SE2","£365,000",Apartment,1.0,1.0,Ask agent
"Willingham Terrace, Kentish Town, NW5","£365,000",Apartment,1.0,1.0,Ask agent
"Uxbridge Road, W3","£365,000",Flat,1.0,1.0,603 sq ft
"London Road, London, SE23","£365,000",Apartment,2.0,2.0,Ask agent
"Priam House, Old Bethnal Green Road, London,","£365,000",Flat,1.0,1.0,501 sq ft
"Offenham Road, Oval","£365,000",Flat,1.0,1.0,Ask agent
"Clarissa Street, Hackney, E8","£365,000",Flat,1.0,1.0,Ask agent
"Buckleigh Road, Streatham","£365,000",Flat,1.0,1.0,Ask agent
"Gibson Road, London, SE11","£365,000",Apartment,1.0,1.0,Ask agent
"Camac Road, Twickenham","£365,000",Flat,1.0,1.0,Ask agent
"Blair Street, London, E14","£365,000",Flat,1.0,1.0,Ask agent
"Maygrove Road, West Hampstead","£365,000",Flat,1.0,1.0,Ask agent
"Barrowell Green, London, N21","£365,000",Ground Maisonette,2.0,1.0,Ask agent
"Norman Road, Greenwich, SE10 9QZ","£365,000",Flat,1.0,1.0,Ask agent
"Two Bedroom Flat in Harlesden, NW10","£365,000",Flat,2.0,2.0,Ask agent
"The Hudson, London, E15","£365,000",Flat,1.0,1.0,"406-1,066 sq ft"
"Bermuda Way, E1 4GD, Stepney, London, E1","£365,000",Flat,1.0,1.0,498 sq ft
"Macleod Street, London, SE17","£365,000",Apartment,1.0,1.0,Ask agent
"5 Hutchings Street, London, E14","£365,000",Flat,1.0,2.0,Ask agent
"Moore House, Canary Wharf, London, E14","£365,000",Flat,1.0,1.0,475 sq ft
"Cottage Grove, Clapham North, London, SW9","£365,000",Flat,1.0,1.0,458 sq ft
"Elmington Road, London","£365,000",Flat,1.0,1.0,Ask agent
"Wood Street, Walthamstow","£365,000",Flat,1.0,1.0,559 sq ft
"North Block, Metro Central Heights, Elephant & Castle, SE1","£365,000",Apartment,1.0,1.0,509 sq ft
"Styles Gardens, Minet Road, London, SW9","£365,000",Apartment,3.0,1.0,805 sq ft
"Vellum Court, Hillyfield, Walthamstow, E17","£365,000",Flat,1.0,1.0,Ask agent
"Bowes Road, London, N11","£365,000",Apartment,2.0,1.0,Ask agent
"High Street, 
Brentford,
TW8 0AA","£365,000",Flat,1.0,1.0,515 sq ft
"Donnington Road, Willesden, London","£365,000",Flat,1.0,1.0,504 sq ft
"Shalford House, Law Street, Bermondsey","£365,000",Flat,2.0,1.0,Ask agent
"Rose Bates Drive, Kingsbury, London, NW9","£365,000",Apartment,2.0,1.0,Ask agent
"Pilch House, Violet Road, London, E3","£365,000",Apartment,1.0,1.0,Ask agent
"Wedmore Street, N19 4RD","£365,000",Flat,1.0,1.0,622 sq ft
"Duncombe House, Woolwich Riverside, London, SE18","£365,000",Studio,,1.0,432 sq ft
"Rathbone Street, Canning Town, E16","£365,000",Flat,1.0,1.0,Ask agent
