Address,Price,Property Type,Bedrooms,Bathrooms,Size
"Bloxhall Road, London, E10","£300,000",,1.0,1.0,Ask agent
"Lewisham Hill, Blackheath, SE13","£300,000",Flat,1.0,,500 sq ft
"Ridsdale Road, SE20, Anerley, London, SE20","£300,000",Flat,2.0,1.0,569 sq ft
"Marlborough Close, Walworth, London","£300,000",Apartment,1.0,1.0,Ask agent
"Fairmont House, 13 Beaufort Square, London, NW9","£300,000",Studio,,1.0,367 sq ft
"Blackwall Way, London","£300,000",Apartment,1.0,1.0,Ask agent
"Reaston Street, London, SE14","£300,000",Flat,1.0,1.0,Ask agent
"Bycullah Road, Enfield","£300,000",Ground Flat,1.0,1.0,Ask agent
Judd Street Bloomsbury WC1H,"£300,000",Studio,,1.0,Ask agent
"Panmure Road, London","£300,000",Apartment,1.0,1.0,Ask agent
"Caledonian Road,  Islington, N1","£300,000",Flat,1.0,1.0,448 sq ft
"Bell Lane, London, NW4","£300,000",Flat,2.0,,548 sq ft
"West Gate, London, W5","£300,000",Apartment,1.0,1.0,481 sq ft
"Pathfield Road, London, London, SW16 5NN","£300,000",Flat,2.0,1.0,Ask agent
"Ambleside Avenue, Streatham","£300,000",Flat,1.0,1.0,Ask agent
"Lindal Court, South Woodford, E18","£300,000",Flat,2.0,1.0,706 sq ft
"GURNEY ROAD, Maryland, London, E15","£300,000",Flat,1.0,1.0,484 sq ft
"Howard Road, London SE25","£300,000",Ground Flat,2.0,1.0,626 sq ft
"Nunhead Lane, Peckham Rye, London, SE15","£300,000",Apartment,1.0,1.0,Ask agent
"Bellingham Road, Catford, London, SE6","£300,000",Flat,2.0,1.0,836 sq ft
"Pendennis Road, Streatham","£300,000",Flat,1.0,1.0,Ask agent
"Highfield Close, London, SE13","£300,000",Flat,1.0,1.0,Ask agent
"Wilkinson Way, Chiswick","£300,000",Flat,2.0,1.0,Ask agent
"Hammersley Road, London, E16","£300,000",Apartment,1.0,1.0,461 sq ft
"Gipsy Hill, Crystal Palace","£300,000",Flat,1.0,1.0,Ask agent
"Clayponds Lane, Brentford, Middlesex","£300,000",Apartment,1.0,1.0,Ask agent
"Empress Avenue, London, E12","£300,000",Flat,2.0,1.0,Ask agent
"Commercial Road, Limehouse","£300,000",Flat,1.0,1.0,Ask agent
"Upper Richmond Road, Wandsworth","£300,000",Flat,1.0,1.0,Ask agent
"Gainsborough Road, London, N12","£300,000",Flat,1.0,1.0,Ask agent
"Sunningfields Road, Hendon, London","£300,000",Flat,1.0,1.0,527 sq ft
"Great North Road, Highgate, N6","£300,000",Apartment,1.0,1.0,373 sq ft
"De Beauvoir Estate, Islington, N1","£300,000",Flat,1.0,1.0,581 sq ft
"Shirland Road, Maida Hill, W9","£300,000",Flat,1.0,1.0,402 sq ft
"Mill Hill East, London, NW7","£300,000",Flat,1.0,,660 sq ft
"Trobridge Parade, NW9","£300,000",Apartment,1.0,1.0,Ask agent
"Jackson Road, Top Floor Flat, Holloway, London, N7","£300,000",Apartment,1.0,1.0,387 sq ft
"Grove Vale, East Dulwich, London, SE22","£300,000",Flat,1.0,1.0,499 sq ft
"Portland Road, London","£300,000",Flat,1.0,1.0,549 sq ft
"Lyveden Road, Tooting/Colliers Wood Borders","£300,000",Flat,1.0,1.0,508 sq ft
"Abingdon Close, South Bermondsey, London, SE1","£300,000",Flat,1.0,1.0,390 sq ft
"St. Donatts Road, New Cross, SE14","£300,000",Apartment,1.0,1.0,Ask agent
"Bulwer Street, W12","£300,000",Flat,1.0,1.0,382 sq ft
"Varcoe Road, London","£300,000",Flat,1.0,1.0,Ask agent
"Miles Close, Thamesmead West, SE28 0NJ","£300,000",Apartment,2.0,1.0,818 sq ft
"Flat 16 Elizabeth Court, 47 Milmans Street, London, SW10 0DA","£300,000",Retirement Property,1.0,,Ask agent
"Galatea Square, Peckham","£300,000",Flat,1.0,1.0,Ask agent
"Kara Court, 
15 Seven Sea Gardens, E3","£300,000",Flat,,1.0,422 sq ft
"Wharfside Point South, 4 Prestons Road, London, E14","£300,000",Apartment,1.0,1.0,455 sq ft
"Ghent Street, London, SE6","£300,000",Maisonette,1.0,1.0,Ask agent
"Boulevard Drive, London","£300,000",Flat,2.0,1.0,Ask agent
"High Mount, London","£300,000",Flat,1.0,1.0,Ask agent
"High Ridge, Sydney Road, London, N10","£300,000",Apartment,1.0,1.0,509 sq ft
"Florian Court, Hastings Road, London, E16","£290,000",Flat,1.0,1.0,431 sq ft
"Malta Road, Leyton","£300,000",Ground Flat,1.0,1.0,Ask agent
"Moremead Road, London, SE6","£300,000",Maisonette,2.0,1.0,538 sq ft
"Manor Estate, Bermondsey, London, SE16","£300,000",Flat,2.0,1.0,670 sq ft
"Sienna Alto, Lewisham SE13","£300,000",Apartment,1.0,1.0,Ask agent
"Woodside Green, London, SE25","£300,000",Apartment,2.0,1.0,Ask agent
"Talwin Street, Bow, London, E3","£300,000",Flat,1.0,1.0,433 sq ft
"Titley Close, Chingford, E4 8PL","£300,000",Flat,1.0,1.0,Ask agent
"Bromley Road, London","£300,000",Flat,3.0,1.0,Ask agent
"Atkins Square, Hackney, E8","£300,000",Flat,1.0,1.0,Ask agent
"89 Park Road, London","£300,000",Apartment,1.0,1.0,Ask agent
"Springbank Road, Lewisham","£300,000",Flat,1.0,1.0,Ask agent
"Coppermill Lane, Walthamstow","£300,000",Flat,1.0,1.0,481 sq ft
"Pinnell Road, London, SE9","£300,000",Flat,2.0,1.0,554 sq ft
"London Road, London, SW16","£300,000",Apartment,1.0,1.0,Ask agent
"Camberwell Road, Camberwell, London, SE5","£300,000",Flat,2.0,1.0,646 sq ft
"Gardner Close, Wanstead","£300,000",Flat,1.0,1.0,446 sq ft
"Apple Tree Road, London, N17","£300,000",Apartment,1.0,1.0,425 sq ft
"Somerset Gardens, Creighton Road, London, N17","£300,000",Apartment,2.0,1.0,Ask agent
"Anerley Road, London, SE20","£300,000",Flat,1.0,1.0,Ask agent
"Beulah Hill, London","£300,000",Flat,2.0,1.0,Ask agent
"Queensway, London,  W2, W2","£300,000",Flat,,,295 sq ft
"Hamlet Gardens, Hammersmith","£300,000",Flat,1.0,1.0,Ask agent
"Laleham Avenue, Mill Hill, London, NW7","£300,000",Maisonette,1.0,1.0,Ask agent
"Binfield Road, London","£300,000",Ground Flat,1.0,1.0,Ask agent
"Amesbury Avenue, Streatham Hill","£300,000",Flat,1.0,1.0,Ask agent
"Tooting Bec Gardens, Streatham","£300,000",Flat,1.0,1.0,Ask agent
"Ansell House, Mile End Road, Whitechapel, London, E1","£300,000",Flat,1.0,1.0,557 sq ft
"Calderon Road, Leytonstone","£300,000",Flat,1.0,1.0,410 sq ft
"Rectory Field Crescent, LONDON, SE7","£300,000",Apartment,1.0,1.0,Ask agent
"Lowfield Road, West Hampstead","£300,000",Flat,2.0,1.0,Ask agent
"Grosvenor Road, Richmond, TW10","£300,000",Flat,1.0,1.0,Ask agent
"Sherwood Gardens, Bermondsey","£300,000",Flat,1.0,1.0,Ask agent
"Davidson Terraces, Windsor Road, E7","£300,000",Flat,2.0,1.0,Ask agent
"Shearwater Drive, London","£300,000",Flat,1.0,1.0,Ask agent
"32 Blackheath Road, Greenwich, SE10","£300,000",Flat,1.0,1.0,Ask agent
"24 Montpelier Row, London, SE3","£300,000",Studio,,1.0,380 sq ft
"Varcoe Road, London, SE16","£300,000",Flat,1.0,1.0,517 sq ft
"Moree Way, London, N18","£300,000",Flat,2.0,1.0,Ask agent
"Channelsea Road, London, E15","£300,000",Apartment,1.0,1.0,Ask agent
"Granby Road, London","£300,000",Maisonette,2.0,1.0,Ask agent
"BIRNBECK COURT, 850 FINCHLEY ROAD, NW11 6BB, LONDON, NW11","£300,000",Flat,2.0,2.0,63 sq ft
"Field Court, 3 Wellington Road, London, SW19","£300,000",Apartment,1.0,1.0,Ask agent
"64a Palmerston Road, Walthamstow, London, E17 6PG","£300,000",Flat,2.0,1.0,592 sq ft
"Michigan Avenue, London, E12","£300,000",Apartment,1.0,1.0,495-538 sq ft
"Keswick Road, 
East Putney, SW15","£300,000",Flat,,1.0,Ask agent
"Evelyn Street, Deptford, London, SE8","£300,000",Flat,1.0,1.0,533 sq ft
"Arrandene Apartments, Silverworks Close, Colindale, NW9","£300,000",Apartment,1.0,1.0,565 sq ft
"Kersfield Road, London","£300,000",Apartment,1.0,1.0,Ask agent
"Park House, London NW10","£300,000",Apartment,1.0,1.0,Ask agent
"Elmington Estate, London, SE5","£300,000",Flat,1.0,1.0,Ask agent
"Tarling Street, London, E1 0AD","£300,000",Flat,2.0,1.0,635 sq ft
"Oman Avenue, Gladstone Park, London, NW2","£300,000",Flat,1.0,1.0,538 sq ft
"Kingston Road, Raynes Park, London, SW20","£300,000",Apartment,1.0,1.0,Ask agent
"Bishops Mead, Camberwell Road, London, SE5","£300,000",Apartment,1.0,1.0,Ask agent
"Trundleys Road, London, SE8","£300,000",Apartment,1.0,1.0,422 sq ft
"Katherine Road, London","£300,000",Flat,2.0,1.0,Ask agent
"Sandycombe Road, Kew","£300,000",Studio,,1.0,Ask agent
"Fairmont Avenue, Canary Wharf","£300,000",Flat,1.0,1.0,Ask agent
"Wilshaw Close, London","£300,000",Flat,1.0,1.0,Ask agent
"Luxembourg Mews, London, E15","£300,000",Flat,1.0,1.0,Ask agent
"Chelsea Cloisters, Sloane Avenue, London, SW3","£300,000",Flat,,1.0,190 sq ft
"Sylvan Road, Crystal Palace","£300,000",Maisonette,2.0,1.0,Ask agent
"Eastdown Park, London","£300,000",Apartment,1.0,1.0,Ask agent
"Little St. Leonards, East Sheen, SW14","£300,000",Flat,1.0,1.0,Ask agent
"Sandycombe Road, Kew","£300,000",Studio,,1.0,Ask agent
"191 Anerley Road, LONDON, London, SE20","£300,000",Flat,1.0,1.0,Ask agent
"Rosendale Road, Dulwich","£300,000",Flat,1.0,1.0,Ask agent
"Newington Causeway, Elephant & Castle","£300,000",Flat,1.0,1.0,Ask agent
"Hallsville Road, London, E16","£300,000",Flat,1.0,1.0,527 sq ft
"New Cross Road, London, SE14","£300,000",Flat,1.0,1.0,Ask agent
"Jack Clow Road, Stratford, E15","£300,000",Flat,1.0,1.0,Ask agent
"Liberty House, Raynes Park","£289,950",Retirement Property,1.0,1.0,605 sq ft
"Devons Road, London, E3","£299,999",Flat,1.0,1.0,430 sq ft
"West Gate, London, W5","£299,999",Flat,2.0,2.0,Ask agent
"Arizona Building, Onese8 Development, Deals Gateway, Lewisham, SE13","£299,999",Apartment,1.0,1.0,Ask agent
"Flat , Selkirk Court, Whitley Road, London","£299,999",Apartment,2.0,1.0,Ask agent
"Limetree Walk, Tooting","£299,999",Flat,1.0,1.0,Ask agent
"Westgate House, Hanger Lane","£299,999",Apartment,2.0,1.0,450 sq ft
"Rockbourne Road, London, SE23 2","£299,995",Flat,1.0,1.0,Ask agent
"Drapers Road, Enfield","£299,995",Maisonette,2.0,1.0,Ask agent
"Artichoke Hill, London, E1W","£299,995",Apartment,1.0,1.0,503 sq ft
"Eagle Heights, Waterside Way, London, N17","£299,995",Studio,,1.0,Ask agent
"24 Rockbourne Road, SE23","£299,995",Maisonette,1.0,1.0,Ask agent
"Lichfield Road, Edmonton, N9","£299,995",Ground Flat,2.0,1.0,703 sq ft
"Artichoke Hill, London, E1W","£299,995",Apartment,1.0,1.0,501 sq ft
"Idaho Building, Onese8 Development, Deals Gateway, Lewisham, SE13","£299,995",Apartment,1.0,1.0,Ask agent
"Oak Grove, Cricklewood, NW2","£299,995",Flat,1.0,1.0,416 sq ft
"Artichoke Hill, Wapping","£299,995",Flat,1.0,1.0,Ask agent
"Elmwood, 34 Churchfields, South Woodford, London, E18 2QZ","£299,995",Apartment,1.0,1.0,Ask agent
"Shelley Way, Wimbledon","£299,950",Flat,1.0,1.0,398 sq ft
"Grahame Park Way, London","£299,950",Flat,1.0,1.0,Ask agent
"Court Farm Road, London","£299,950",Apartment,1.0,1.0,Ask agent
"Highfield Close, Hither Green","£299,950",Flat,1.0,1.0,Ask agent
"Cavendish Road, London, NW6","£299,950",Flat,1.0,1.0,Ask agent
"Joseph Hardcastle Close, New Cross","£299,950",Flat,2.0,2.0,Ask agent
"New Cross Gate, London, SE14","£299,950",Apartment,2.0,1.0,Ask agent
"Court Farm Road, London","£299,950",Apartment,1.0,1.0,Ask agent
"Brownlow Road, London","£299,950",Flat,1.0,1.0,Ask agent
"Cherry Blossom Close, Palmers Green, London, N13","£299,950",Flat,2.0,1.0,Ask agent
"Gladbeck Way, Enfield, EN2","£299,950",Flat,2.0,1.0,Ask agent
"Weavers Close, Isleworth","£299,950",Maisonette,1.0,,Ask agent
"Waldegrave Park, Twickenham","£299,950",Studio,,1.0,Ask agent
"Hillyard Street, Stockwell","£299,950",Flat,1.0,1.0,Ask agent
"Colney Hatch Lane, London","£299,950",Flat,1.0,1.0,Ask agent
"Deals Gateway, Lewisham, London","£299,950",Apartment,1.0,1.0,449 sq ft
"Lee Road, Blackheath","£299,950",Flat,1.0,1.0,Ask agent
"Court Farm Road, Eltham","£299,950",Flat,1.0,1.0,570 sq ft
"Dacres Road, Forest Hill, London, SE23","£299,950",Flat,1.0,1.0,Ask agent
"Roderick Road, Hampstead, London, NW3","£299,950",Flat,1.0,1.0,Ask agent
"Court Farm Road, Eltham","£299,950",Flat,1.0,1.0,549 sq ft
"Pears Road, Hounslow","£299,950",Flat,1.0,1.0,Ask agent
"Stanley Road, Teddington, Middlesex, TW11","£299,950",Apartment,1.0,1.0,Ask agent
"Pennard Mansions, Shepherd's Bush W12","£299,950",Studio,,1.0,Ask agent
"Broadfields Way, London, NW10","£299,950",Flat,2.0,1.0,Ask agent
"Tulse Hill, London, SW2","£299,950",Apartment,1.0,1.0,Ask agent
"Brougham Road, Acton","£299,950",Flat,,1.0,Ask agent
"Court Farm Road, London, SE9","£299,950",Apartment,1.0,1.0,Ask agent
"Court Farm Road, Eltham, SE9","£299,950",Apartment,1.0,1.0,Ask agent
"High Road, London, NW10","£299,950",Apartment,1.0,1.0,Ask agent
"Victoria Road, Acton","£299,950",Flat,1.0,1.0,Ask agent
"Cambridge Road, Teddington","£299,950",Flat,1.0,,Ask agent
"Egerton Drive, Isleworth","£299,950",Apartment,2.0,1.0,Ask agent
"Elmington Road, Camberwell, London","£299,900",Flat,1.0,1.0,Ask agent
"Windmill Drive, London, NW2","£299,500",Flat,1.0,1.0,Ask agent
"3 Station Approach, Woodside Park, London, N12","£299,300",Apartment,1.0,1.0,Ask agent
"Beaufort Square, Colindale, NW9 4FJ","£299,000",Studio,,1.0,452 sq ft
"Oak Grove, Cricklewood","£299,000",Flat,1.0,1.0,Ask agent
"Moreton Street, Westminster","£299,000",Studio,,1.0,Ask agent
"White Lodge Close, Isleworth","£299,000",Apartment,1.0,1.0,Ask agent
"Neasden Lane, London, NW10","£299,000",Flat,1.0,1.0,Ask agent
"Highfield Avenue, London, NW9","£299,000",Flat,1.0,1.0,Ask agent
"Munster Road, Munster Village, London, SW6","£299,000",Flat,1.0,1.0,260 sq ft
King Arthur Close Peckham,"£299,000",Apartment,1.0,1.0,Ask agent
"Munster Road, Fulham","£299,000",Flat,1.0,1.0,Ask agent
"Munster Road, Munster Village, London, SW6","£299,000",Flat,1.0,1.0,295 sq ft
"Temple Fortune Mansions, NW11","£299,000",Flat,,1.0,431 sq ft
"Munster Road, Fulham","£299,000",Flat,1.0,1.0,Ask agent
"Strathdon Drive, Tooting, SW17","£299,000",Flat,1.0,1.0,538 sq ft
"King Arthur Close, Peckham, SE15","£299,000",Flat,1.0,1.0,Ask agent
"London Road, London","£299,000",Flat,3.0,2.0,Ask agent
"Sweden Gate, London, SE16","£299,000",Apartment,1.0,1.0,Ask agent
"52 Aerodrome Road, Colindale, NW9","£298,500",Apartment,1.0,1.0,Ask agent
"Cornmill Lane, Sienna Alto, SE13","£298,000",Apartment,1.0,1.0,484 sq ft
"Selborne Road, Walthamstow","£297,500",Apartment,2.0,1.0,Ask agent
"Hanger Lane, Ealing, London, W5","£297,500",Flat,1.0,1.0,491 sq ft
"Cheyne Walk, Chelsea, SW10","£297,000",House Boat,,,Ask agent
"Epstein Road, London","£297,000",Semi-Detached,3.0,1.0,Ask agent
"Belsize Road, Kilburn, London, NW6","£297,000",Apartment,1.0,1.0,451 sq ft
"Thames Circle, London, E14","£297,000",Apartment,1.0,1.0,312 sq ft
"Belsize Road, London","£297,000",Apartment,1.0,1.0,Ask agent
"32 Jupp Road West, Stratford","£297,000",Apartment,2.0,1.0,Ask agent
"Greyhound Road, Fulham","£295,000",Studio,,1.0,Ask agent
"Newton Road, London","£295,000",Flat,1.0,1.0,Ask agent
"Woodgate Drive, Streatham","£295,000",Flat,1.0,1.0,Ask agent
"Neville Close, Peckham, London, SE15","£295,000",Flat,1.0,1.0,504 sq ft
"The Sphere, Canning Town, London, E16","£295,000",Flat,1.0,1.0,476 sq ft
"Oslac Road, London","£295,000",Apartment,2.0,1.0,Ask agent
"Kidbrooke Grove, London, SE3","£295,000",Flat,1.0,,545 sq ft
"Sydney Road, N10","£295,000",Flat,1.0,1.0,Ask agent
"Jacks Farm Way, London, E4","£295,000",Apartment,1.0,1.0,Ask agent
"Shepherds Bush Road, London","£295,000",Studio,,1.0,Ask agent
"Devonshire Road, Prime Colliers Wood","£295,000",Apartment,1.0,1.0,Ask agent
"Solomons Court, 451 High Road, North Finchley, N12","£295,000",Apartment,1.0,1.0,442 sq ft
"Plantation Wharf Pier, Clove Hitch Quay, London, SW11","£295,000",House Boat,3.0,1.0,Ask agent
"Holley Road, London","£295,000",Ground Flat,1.0,1.0,Ask agent
"Effra Court, Brixton Hill","£295,000",Apartment,1.0,1.0,Ask agent
"Beulah Hill, Norwood","£295,000",Flat,3.0,1.0,Ask agent
"Ontario Tower, Canary Wharf, London, E14","£295,000",Flat,1.0,1.0,543 sq ft
"Neasden Lane, London, NW10","£295,000",Flat,1.0,1.0,Ask agent
"Oliver Grove, South Norwood, London, SE25","£295,000",Flat,1.0,1.0,Ask agent
"Ontario Tower, Fairmont Avenue, London, E14","£295,000",Flat,1.0,1.0,Ask agent
"Horne House, London","£295,000",Apartment,3.0,1.0,872 sq ft
"Telford Avenue, London, SW2","£295,000",Apartment,1.0,1.0,Ask agent
"Elmstead Lane, Chislehurst","£295,000",Flat,2.0,1.0,Ask agent
"Shooters Hill Road, Shooters Hill, London, SE18","£295,000",Apartment,1.0,1.0,Ask agent
"Leinster Gardens, 
Bayswater, W2","£295,000",Flat,,1.0,248 sq ft
"Edwin Street, London","£295,000",Apartment,1.0,1.0,Ask agent
"Westow Hill, London, SE19","£295,000",Apartment,1.0,1.0,Ask agent
"Butchers Road, Canning Town, London, E16","£295,000",Flat,2.0,1.0,724 sq ft
"Queens Court, Bayswater W2","£295,000",Flat,,1.0,Ask agent
"Molesworth Street, Lewisham, London, SE13","£295,000",Flat,1.0,1.0,454 sq ft
"Molesworth Street, Lewisham, London, SE13","£295,000",Flat,1.0,1.0,506 sq ft
"Butchers Road, London","£295,000",Flat,2.0,1.0,Ask agent
"Colyton Road, London, SE22","£295,000",Apartment,1.0,1.0,Ask agent
"Amblecote Road, London, SE12","£295,000",Apartment,2.0,1.0,Ask agent
"Maltings Close, Bow","£295,000",Flat,1.0,1.0,546 sq ft
"Falloden Way, Hampstead Garden Suburb, NW11","£295,000",Maisonette,2.0,1.0,667 sq ft
"Beaulieu Place, Chiswick","£295,000",Studio,,1.0,286 sq ft
"Needleman Close, London, NW9","£295,000",Apartment,1.0,1.0,Ask agent
"Worton Road, Isleworth","£295,000",Apartment,2.0,1.0,Ask agent
"Waterside Heights, 16 Booth Road, Pontoon Dock, London, E16 2GP","£295,000",Flat,1.0,1.0,Ask agent
"Church Road, London","£295,000",House,1.0,1.0,489 sq ft
"Radley Court, Selhurst Road, South Norwood, SE25","£295,000",Flat,2.0,1.0,Ask agent
"CORNER FINCHLEY ROAD AND WEST HEATH AVENUE, GREATER LONDON, NW11","£295,000",Flat,1.0,1.0,Ask agent
"Gardiner House, Surrey Lane, Battersea, London, SW11","£295,000",Flat,1.0,1.0,489 sq ft
"Ferdinand Court, Adenmore Road, London, SE6 4BG","£295,000",Apartment,1.0,1.0,Ask agent
"Newington Causeway, Elephant & Castle","£295,000",Flat,,1.0,Ask agent
"Tanfield Avenue, London, NW2","£295,000",Flat,1.0,1.0,Ask agent
"Camdenhurst Street, London, E14","£295,000",Apartment,1.0,1.0,Ask agent
"Westferry Road, London, E14","£295,000",Flat,1.0,1.0,552 sq ft
"Priory Road, West Hampstead","£295,000",Studio,,1.0,Ask agent
"Woodrow, Woolwich","£295,000",Flat,1.0,1.0,Ask agent
"Carlton Grove, London, SE15","£295,000",Maisonette,1.0,1.0,Ask agent
"Kingston Road, Wimbledon, London, SW20","£295,000",Studio,,1.0,434 sq ft
"Green Lanes, London, N21","£295,000",Flat,2.0,1.0,Ask agent
"Charterhouse Square, Florin Court","£295,000",Studio,,1.0,Ask agent
"Adenmore Road, Catford, SE6","£295,000",Flat,1.0,1.0,441 sq ft
"Conington Road, London","£295,000",Apartment,1.0,1.0,Ask agent
"Laleham Heights, Carswell Road, London, SE6 2JQ","£295,000",Flat,1.0,1.0,547 sq ft
"Galley House, Atlantis Avenue, London, E16","£295,000",Flat,1.0,1.0,Ask agent
"Westcott Close, London","£295,000",Flat,1.0,1.0,Ask agent
"Gordon Road, Enfield","£295,000",Apartment,1.0,1.0,Ask agent
"Atlantis Avenue, Gallions Reach, LONDON, E16","£295,000",Flat,1.0,1.0,627 sq ft
"Fermoy Road, W9","£295,000",Flat,,1.0,341 sq ft
"Sky Studios, Silvertown, London, E16","£295,000",Flat,1.0,1.0,690 sq ft
"The Broadway, London, N9","£295,000",Flat,2.0,,705 sq ft
"Palace Road, Streatham, SW2","£295,000",Apartment,1.0,1.0,Ask agent
"Woburn Place, Bloomsbury","£295,000",Studio,,1.0,Ask agent
"Hichisson Road, London, SE15","£295,000",Flat,1.0,1.0,Ask agent
"St Andrews Road, Kingsbury, NW9 8DL","£295,000",Maisonette,1.0,1.0,Ask agent
"Hockley Avenue,London,E6","£295,000",Flat,2.0,1.0,Ask agent
"Sydenham Hill, London, SE26","£295,000",Apartment,1.0,,Ask agent
"Glebe Way, Hanworth","£295,000",Maisonette,1.0,1.0,473 sq ft
"Gordon Road, Enfield","£295,000",Flat,1.0,1.0,709 sq ft
"Hyde Court, Church Lane, Kingsbury, London, NW9","£295,000",Apartment,2.0,1.0,636-637 sq ft
"Freemasons Road, London, E16","£295,000",Flat,1.0,1.0,Ask agent
"The High, Streatham High Road, SW16","£295,000",Apartment,1.0,1.0,Ask agent
"Harley Road, Harlesden, NW10","£295,000",Apartment,1.0,1.0,647 sq ft
"Flat 411, Chalmers House, York Road, Battersea, London, SW11 3QT","£295,000",Flat,2.0,,Ask agent
"King Street, London","£295,000",Studio,,1.0,Ask agent
"Fairmont Avenue, London, E14","£295,000",Flat,1.0,1.0,300 sq ft
"Henley Cross,
Kidbrooke,
London,
SE3 9JU","£294,375",Apartment,1.0,1.0,555 sq ft
"Sunningfields Road, Hendon, NW4","£294,000",Apartment,1.0,1.0,Ask agent
"50 Capitol Way, London","£294,000",Apartment,1.0,1.0,Ask agent
"50 Capitol Way, London","£294,000",Apartment,1.0,1.0,Ask agent
"111 Catford Hill, Catford","£294,000",Flat,2.0,1.0,Ask agent
"Varcoe Road, Bermondsey, SE16","£294,000",Flat,1.0,1.0,Ask agent
"Charles Darwin House, Canning Town, E16","£294,000",Apartment,2.0,2.0,Ask agent
"Varcoe Road, South Bermondsey, SE16","£294,000",Flat,1.0,1.0,Ask agent
"Peel Road, South Woodford","£294,000",Flat,1.0,1.0,538 sq ft
"Dara House, Capitol Way, NW9","£294,000",Flat,1.0,,503 sq ft
"Hathaway Crescent, Manor Park, London, E12","£294,000",Flat,2.0,1.0,Ask agent
"Catford Hill, Catford, London, SE6","£294,000",Flat,2.0,1.0,614 sq ft
"Fairbourne Road, London","£292,500",Apartment,2.0,2.0,Ask agent
"Royal Crest Avenue, Newham,
London, 
E16 2AX","£290,625",Flat,1.0,,Ask developer
"90 Great North Way, , Hendon, London, ., NW4 1HE","£290,000",Flat,2.0,2.0,Ask agent
"Braddock Close, Isleworth","£290,000",Flat,1.0,1.0,Ask agent
"Harrier Way, Beckton","£290,000",Flat,2.0,1.0,463 sq ft
"The Fusion Building, East India Dock Road, E14","£290,000",Flat,2.0,2.0,721 sq ft
"Uxbridge Road, Acton, London, ., W3 9BF","£290,000",Flat,1.0,1.0,Ask agent
"Lovelinch Close, London, SE15","£290,000",Flat,2.0,,Ask agent
"Foxwood Green Close, Bush Hill Park EN1 2TB","£290,000",Apartment,1.0,1.0,Ask agent
"Varcoe Road, London","£290,000",Apartment,1.0,1.0,Ask agent
"Marlowe Gardens, London, Greater London, SE9","£290,000",Apartment,2.0,1.0,Ask agent
"South Norwood, SE25, South Norwood, London, SE25","£290,000",Maisonette,2.0,1.0,476 sq ft
"Hallsville Road, London, E16","£290,000",Flat,1.0,1.0,Ask agent
"Capitol Way, Colindale, London, NW9","£290,000",Flat,1.0,1.0,503 sq ft
"Gray House, New Road, Abbey Wood","£290,000",Flat,2.0,1.0,Ask agent
"Mapleton Road, SW18","£290,000",Flat,,1.0,440 sq ft
"Capitol Way, Colindale, London, NW9","£290,000",Flat,1.0,1.0,540 sq ft
"Daling Way, London, E3","£290,000",Flat,3.0,1.0,Ask agent
"Boveney Road, London, United Kingdom, SE23","£290,000",Apartment,1.0,1.0,Ask agent
"Brydale House, Rotherhithe Street, London, SE16 2PT","£290,000",Flat,1.0,1.0,Ask agent
"Old Kent Road, Bermondsey","£290,000",Flat,1.0,1.0,Ask agent
1 Bedroom Apartment For Sale,"£290,000",Flat,1.0,1.0,Ask agent
"Varsity Drive, Twickenham, TW1","£290,000",Apartment,1.0,1.0,Ask agent
"Grahame Park Way, London","£290,000",Flat,1.0,1.0,Ask agent
"Red Lion Square, Wandsworth, London, SW18","£290,000",Apartment,,1.0,322 sq ft
"Buckleigh Road, Streatham","£290,000",Apartment,1.0,1.0,Ask agent
"Hermitage Close, London, SE2","£290,000",Flat,2.0,1.0,Ask agent
"Woburn Place, London, WC1H","£290,000",Studio,,1.0,262 sq ft
"Deals Gateway, London SE13 - Great City Access!","£290,000",Flat,1.0,1.0,463 sq ft
"Chingford Avenue, Chingford, E4","£290,000",Apartment,2.0,1.0,Ask agent
"High Level Drive, London, SE26","£290,000",Apartment,2.0,1.0,Ask agent
"Holland Road, London, NW10","£290,000",Flat,1.0,1.0,Ask agent
"Saw Mill Way, London, N16","£290,000",Apartment,1.0,1.0,559 sq ft
"Myers Lane, New Cross, London, SE14","£290,000",Apartment,2.0,1.0,Ask agent
"Felixstowe Road, London, N9","£290,000",Maisonette,2.0,1.0,Ask agent
"Cavendish Road, Balham","£290,000",Flat,1.0,1.0,Ask agent
"Lucas Gardens, East Finchley, N2","£290,000",Apartment,1.0,1.0,509 sq ft
"Lanacre Avenue, London, NW9","£290,000",Apartment,1.0,1.0,Ask agent
"Camdenhurst Street, Limehouse","£290,000",Flat,1.0,1.0,Ask agent
"Great North Way, London, NW4","£290,000",Apartment,2.0,2.0,Ask agent
"Grove Place, London, SE9","£290,000",Flat,1.0,1.0,650 sq ft
"Swingate Lane, Plumstead","£290,000",Apartment,2.0,1.0,Ask agent
"Geary Court, 24 The Concourse, London, N9","£290,000",Flat,2.0,1.0,Ask agent
"Rogate House, 8 Muir Road, London, E5","£290,000",Apartment,1.0,1.0,515 sq ft
"Lawrie Park Road, Sydenham","£290,000",Flat,1.0,1.0,Ask agent
"Falcon Road, London, SW11","£290,000",Flat,1.0,1.0,Ask agent
"Wick Road, London, E9","£290,000",Apartment,1.0,1.0,387 sq ft
"Woodside Green, South Norwood","£290,000",Apartment,2.0,1.0,Ask agent
"St. Georges Grove, Earlsfield/Tooting, London, ., SW17 0FZ","£290,000",Flat,1.0,1.0,Ask agent
"Ron Leighton Way, East Ham, London, E6","£290,000",House,1.0,1.0,Ask agent
"Saw Mill Way, London, N16","£290,000",Flat,1.0,1.0,597 sq ft
"Paxton Road, Forest hill, SE23 2","£290,000",Apartment,2.0,1.0,Ask agent
"Spa Hill, London, SE19","£290,000",Flat,3.0,2.0,Ask agent
"Aylesbury Close, Forest Gate, E7","£290,000",Apartment,2.0,1.0,Ask agent
"Dalston Lane, Hackney","£290,000",Flat,1.0,1.0,Ask agent
"Courthill Road, London, SE13","£290,000",Flat,1.0,1.0,Ask agent
"Woburn Place, Bloomsbury","£290,000",Studio,,1.0,Ask agent
"Langhorn Drive, Twickenham","£290,000",Apartment,1.0,1.0,472 sq ft
Forest Croft Forest Hill,"£290,000",Flat,1.0,1.0,Ask agent
"Samuel Close, London, SE14","£290,000",Apartment,2.0,1.0,545 sq ft
"Manor Close, LONDON, London, SE28","£290,000",Flat,2.0,1.0,Ask agent
"Cadogan Road, Woolwich, London SE18 6YL","£290,000",Flat,1.0,1.0,425 sq ft
"Cowden Street, London, SE6","£290,000",Maisonette,1.0,1.0,Ask agent
"Barking Road, East Ham, London, E6 2LR","£290,000",Flat,2.0,1.0,Ask agent
"Martlesham Walk, Colindale, NW9","£290,000",Apartment,1.0,1.0,528 sq ft
"Oliver Goldsmith Estate, London, SE15","£290,000",Flat,2.0,,Ask agent
